,TEXT,SIZE,FREQMAX,VOLTMAX,AMPMAX
201,"Objective: In children with medically-refractory focal epilepsy, undergoing nTMS for pre-surgical motor mapping, we test whether maturation of the resting motor threshold (rMT), a measure of corticospinal excitability, is distinct in male and female patients. Method(s): 88 children (46m, 4.8y-17.7y; 42f, 4.1y-17.8y) with intractable epilepsy underwent nTMS for functional mapping prior to epilepsy surgery. Bilateral rMT, defined as the minimal stimulation intensity necessary to elicit a response from the APB muscle contralateral to the stimulated hemisphere, of 50 muV, on>50% of trials was measured per patient. Only patients with a (1) focal, unilateral seizure onset zone (2) rMT<100% machine-output and (3) <=18y, were included. Per subject, data were analyzed separately for the ""epileptic"" and ""healthy"" hemisphere. Result(s): In the healthy hemisphere of boys and girls, age is the major determinant ofrMT, which decreases by 9V/m per year throughout childhood (p<.0001). In contrast, the maturational trajectory is distinct between boys and girls in the epileptic hemisphere. Specifically, whereas boys maintain the same maturational trajectory in both healthy and epileptic hemispheres, average rMT in the epileptic hemisphere is lower (p<.0001), and the rMT maturational trajectory (rMTv.age R2=.002; p=.754) is absent in girls. A major distinction among (Figure presented) rMTs measured in the epileptic hemisphere is between young boys and girls (<=12y), where rMT is significantly lower (p<0.0001) in young girls (n=22, average rMT; 113.1+/-36.49) than in young boys (n=22, average rMT; 166.4+/-41.5). Further, in young girls, rMT in the epileptic hemisphere is significantly lower (p<0.0001) than in the healthy hemisphere (mean, 109.15V/m+/-35.7; 143.67V/m+/-60.0, respectively). Conclusion(s): Distinct average rMTs in boys and girls with focal epilepsy indicate that sex is a determinant of the effects that either seizures, epileptogenesis, or both, have on measures of corticospinal excitability.",0,,143.67,
202,"Objective: To describe a rare case of deep brain stimulation (DBS) in the globus pallidus interna (GPi) masking seizure in a Parkinson's Disease (PD) patient. Background(s): Not applicable. Design/Methods: A case report. Result(s): A 77 year old caucasian female with PD receives a DBS targeting bilateral GPi nuclei with activation of the right lead only. She has no history of seizure. Approximately one year after DBS placement she is admitted for treatment of acute onset Bipolar mania. During her hospital stay, she becomes catatonic with rare episodes of left head turning and rigidity. The initial EEG shows a diffuse 60 hertz artifact. The DBS is turned off due to concern for possible behavioral side effects after which EEG reveals multiple right focal seizures with secondary generalization. A brain positron emission tomography (PET) scan shows hypermetabolic activity surrounding the right DBS lead and ipsilateral frontal cortex. Despite multiple anti-epileptic drug (AED) trials, it is not until the DBS is turned back on that the seizures are controlled. The patient reports at the time of follow up she is non-compliant with AEDs. She is exclusively maintained on right lead DBS activation. No further seizure activity is reported. Conclusion(s): Deep brain stimulation for the management of intractable epilepsy has acquired extensive attention recently for its results targeting different areas of the brain. Trials targeting the hippocampus and cortex by responsive neural stimulation (RNS) and DBS targeting the anterior nucleus of the thalamus have shown notable success. Among the targets investigated, the basal ganglia has yet to be extensively studied outside of animal models. This case is a novel example of successful seizure suppression in a patient with GPi lead placement. Prior animal studies suggest neuromodulation of the GPi and its network within the human brain merits further clinical studies in regards to the treatment of intractable epilepsy.",1,,,
203,"Purpose Bilateral deep brain stimulation (DBS) of the anterior nucleus of the thalamus (ANT) reduces seizures and is relatively safe but may be accompanied by complaints of memory problems and depression. This study examined incidence of memory and depression adverse events (AE) in the SANTE study blinded phase and their relationship to objective neurobehavioral measures, baseline characteristics, quality of life and long-term neurobehavioral outcome. Method The neurobehavioral AE and neuropsychological data from a previously reported prospective randomized trial (SANTE) were analyzed. Reliable change indices (RCI) were calculated for memory and mood measures. Analyses examined relationships among AEs, RCIs, demographic and seizure variables, and long-term neurobehavioral outcome. Results No significant cognitive declines or worsening of depression scores were observed through the blinded phase or in open-label at 7-years. Higher scores were observed at 7 years on measures of executive functions and attention. Depression and memory-related AEs were not associated with reliable change on objective measures or 7-year neurobehavioral outcome. The AEs were without significant impact on life quality. Memory and depression AEs were not related to demographic or seizure characteristics, change in seizure frequency, frequency of AE or depression report. Conclusion Bilateral ANT DBS was associated with subjective depression and memory AEs during the blinded phase in a minority of patients that were not accompanied by objective, long-term neurobehavioral worsening. Monitoring and neuropsychological assessment of depression and memory are recommended from a theoretical standpoint and because more memory and depression AEs occurred in the active stimulation than control group.Copyright © 2016 British Epilepsy Association",0,,,
204,"OBJECTIVE Thalamic stimulation can provoke electroencephalography (EEG) synchronization or desynchronization, which can help to reduce the occurrence of seizures in intractable epilepsy, though the underlying mechanism is not fully understood. Therefore, the authors investigated changes in EEG electrical activity to better understand the seizurereducing effects of deep brain stimulation (DBS) in patients with intractable epilepsy. METHODS Electrical activation patterns in the epileptogenic brains of 3 patients were analyzed using classical lowresolution electromagnetic tomography analysis recursively applied (CLARA). Electrical activity recorded during thalamic stimulation was compared with that recorded during the preoperative and postoperative off-stimulation states in patients who underwent anterior thalamic nucleus DBS for intractable epilepsy. RESULTS Interictal EEG was fully synchronized to the frequency in the postoperative on-stimulation period. The CLARA showed that electrical activity during preoperative and postoperative off-stimulation states was localized in cortical and subcortical areas, including the insular, middle frontal, mesial temporal, and precentral areas. No electrical activity was localized in deep nucleus structures. However, with CLARA, electrical activity in the postoperative on-stimulation period was localized in the anterior cingulate area, basal ganglia, and midbrain. CONCLUSIONS Anterior thalamic stimulation could spread electrical current to the underlying neuronal networks that connect with the thalamus, which functions as a cortical pacemaker. Consequently, the thalamus could modify electrical activity within these neuronal networks and influence cortical EEG activity by inducing neuronal synchronization between the thalamus and cortical structures.Copyright © AANS, 2017.",3,,,
205,"View Supplementary Videos 1, 2. We report on a white Afrikaans family from eastern South Africa with three members affected with North Sea progressive myoclonus epilepsy, resulting from a homozygous founder GOSR2 mutation (c.430G>T, p.Gly144Trp). The mutation was identified by exomic sequencing in a research study investigating childhood onset ataxias. All three subjects presented with ataxia, tremor, early gait difficulties, and myoclonic and generalized tonic clonic (GTC) epilepsy. Each patient underwent deep brain stimulation of the caudal Zona Incerta before coming to the attention of the authors. In each case there was a reduction in GTC seizures, and two patients exhibited a reduction in involuntary movements, as evaluated during long-term follow-up. In one case there was an improvement in gait and stance when assessed while the stimulation was on.Copyright © 2016 International Parkinson and Movement Disorder Society",3,,,
206,"Introduction: Approximately one third of patients with focal epilepsy continue to have ongoing seizures despite adequate trials of anti-seizure medications. Surgery to remove the epileptogenic zone remains the most efficacious treatment option for focal drug-resistant epilepsy. However, when cortical areas are eloquent or there are multiple epileptogenic zones, surgical resection is not an ideal approach. Cortical stimulation provides an attractive alternative. Area covered: Here, the authors describe Chronic Subthreshold Cortical Stimulation (CSCS), which uses continuous intracranial electrical stimulation applied near the epileptogenic zone to lower seizure probability. The authors review literature related to CSCS. One challenge is finding the most efficacious set of stimulation parameters for each patient. Expert commentary: Data supporting CSCS are limited but promising for the treatment of patients with focal drug resistant epilepsy who are not surgical candidates. Additional electrophysiological biomarkers to estimate cortical excitability are needed.Copyright © 2017 Informa UK Limited, trading as Taylor & Francis Group.",0,,,
207,"Purpose Anterior thalamic deep brain stimulation (ATN DBS) is an emerging, effective treatment for patients with drug-resistant epilepsy, but long-term results on its efficacy and safety are lacking. To evaluate the long-term efficacy and safety of ATN DBS treatment, as well as predictors of its success, in patients with drug-refractory epilepsy (DRE). Method We retrospectively studied clinical outcomes in 29 consecutive refractory epilepsy patients treated by a single DBS team (two neurosurgeons, four neurologists) over an 11-year period, for whom follow-up was performed for up to 137 months (mean, 74.9 months). Results The average participant was 30.7 (+/-10.4) years old and had epilepsy for 19.3 (+/-9.0) years. The mean preoperative frequency of disabling partial or generalized tonic-clonic seizures was 27.5 (+/-8.6, SE) seizures a month. The median percent seizure reduction was 71.3% at 1 year, 73.9% at 2 years, and ranged from 61.8% to 80.0% over post-implant years 3 through 11 in the long-term study (overall 70% median reduction). In the 11-year study period, 13.8% (4/29) of subjects were seizure-free for at least 12 months during this time. There was only one symptomatic intracranial hemorrhage that happened during follow-up (3.4%). Infection requiring removal and later re-implantation of hardware occurred in only 1 of 30 patients (3.3%), who was subsequently excluded from our follow-up assessment. Hardware malfunction including lead disconnection occurred in 2 of 29 cases (6.9%). Revision of lead position to redeem poor clinical response was performed in 3 of 58 implanted leads (5.2%). Conclusions ATN DBS can be an effective therapy in a variety of patients with DRE. Importantly, we provide evidence that significant therapeutic efficacy can be sustained for up to 11 years. Neurological complications were rather rare, but long-term hardware-related complications should be followed arrectis auribus.Copyright © 2017 British Epilepsy Association",30,,,
208,"Introduction Transcranial magnetic stimulation (TMS) is a noninvasive technique for investigating cortical physiologic functions in the brain. In this study, the effects of continuous theta burst stimulation (cTBS) on motor evoked potential (MEP) parameters in patients with idiopathic generalized epilepsy (IGE) were investigated. Materials and methods Fifteen patients with IGE were included. Motor threshold (MT) and cortical silent period (CSP) were determined before cTBS application. Next, cTBS was applied to the dominant (left) hemisphere M1 hand area as the first application. After 1 day, cTBS was applied first to the left M1 hand area and then to the right lateral cerebellar area as the second application. Parameters were again determined after the applications. Results There was no difference in resting MT values before and after cTBS application (p > 0.05). Although CSP increased after stimulation (p < 0.05), it was not significantly different between applications (p > 0.05). Conclusion For patients with epilepsy, cTBS is a safe technique when applied at a low intensity. The inhibitory effect of cTBS, a noninvasive technique, on cortical excitability in patients with IGE was determined using MEP parameters. The effect lasted at least 1 h. To our knowledge, this is the first study to assess the effect of cTBS on cortical excitability in patients with IGE. Our findings indicate that cTBS decreases cortical excitability in patients with IGE.Copyright © 2017 Elsevier Inc.",15,,,
209,"Background: The Hemiconvulsions-Hemiplegia-Epilepsy (HHE) syndrome is currently regarded as an extremely rare condition. The etiological and pathophysiological mechanisms underlying this medical rarity as well as the optimal therapeutic approaches remain poorly defined and understood. We present the clinical, radiological and electroencephalography (EEG) findings of a patient with the HHE syndrome and describe the response of the continuously present epileptiform abnormalities to transcranial magnetic stimulation (TMS). Case description: A 33-year old male patient was referred to our department for investigation and management of intractable epilepsy. His seizures began at the age of three months when, during the course of a common febrile illness, he developed repetitive clonic seizures involving the left upper and lower limbs, followed by permanent left hemiplegia. After extensive investigations, he was diagnosed with ""idiopathic"" HHE syndrome. Currently, he suffers from left hemiplegia, severe intellectual impairment [Intelligence Quotient (IQ) <30] and asymmetric, bilateral tonic seizures occurring 1-3 times daily despite treatment with valproate, topiramate, lamotrigine, rufinamide, and perampanel. Brain magnetic resonance imaging revealed atrophy of the right hemisphere and serial EEGs disclosed continuous sharp waves, the generators of which were localized by electrical source imaging (ESI) to two distinct sources within the right hemisphere. Repetitive TMS [210 stimuli of 1 Hz at 100 % corticomotor threshold applied with a circular coil over the generators of epileptic discharges (EDs)] resulted in a statistically significant decrease of ED counts compared to sham stimulation and the post-verum TMS period. Conclusion(s): We present the clinical-laboratory profile and the long-term follow up of a patient with the HHE syndrome. Further, we describe the effects of TMS on EDs. The latter observation raises the possibility that TMS-EEG may be used in select cases with intractable epilepsy as a surrogate marker of responsiveness to more invasive modalities (i.e., cortical stimulation).Copyright © 2017, Lithografia Antoniadis I - Psarras Th G.P.. All rights reserved.",1,,,
210,"Neuromodulation techniques targeting limbic circuits can be used to treat refractory psychiatric or neurological disorders. However, objective measure for the impact of neuromodulation on affective brain circuits is lacking. Deep brain stimulation at a key node of the limbic circuit, the anterior thalamic nuclei (ANT-DBS), is used to treat refractory epilepsy. While effective in reducing seizures, patients have reported subjective depressive symptoms as a side effect. In line with potential vulnerability to depression, we have previously shown ANT-DBS to increase attention allocation to threat evidenced by behavior and brain physiology. Rightward frontal alpha asymmetry with greater right hemispheric activation is thought to reflect brain physiology linked with depression and anxiety. To that end, we investigated whether high-frequency electric stimulation at ANT influences frontal alpha asymmetry. Furthermore, we explored the impact of DBS on emotional modulation of frontal alpha asymmetry and whether it is linked with emotional modulation of response speed. Electrical stimulation at ANT led to an increased rightward frontal alpha asymmetry compared to situations where stimulation was off (F(1,12) = 14.09, p = 0.003) or the thalamic control location was stimulated (F(1,12) = 10.19, p = 0.008), along with prolonged reaction times in the context of emotional distractors (F(1,7) = 16.66, p = 0.005). The change was specifically driven by increased activity in the right hemisphere. Furthermore, we found a correlation between the emotional modulation of frontal alpha asymmetry and emotional interference of response speed due to ANT stimulation (r = 0.78, p = 0.02). In conclusion, DBS at ANT increased relative right hemispheric activity and this was linked with emotional modulation of behavior. Previous studies have linked frontal alpha asymmetry with emotion related symptoms and furthermore, Vagus Nerve Stimulation (VNS) has been shown to modulate alpha asymmetry. Thus, in the light of the previous literature and the current findings, we suggest that frontal alpha asymmetry along with emotional interference of response speed might be a feasible biomarker for the effects of neuromodulation on brain's affective circuitry in general.Copyright © 2017 Sun, Perakyla and Hartikainen.",0,,,
211,"Deep brain stimulation has been used in increasing frequency to treat refractory epilepsy. Different targets have been tried, and different epileptic syndromes have been addressed in different ways. We describe the current targeting techniques for the structures presently most often implanted, namely the anterior nucleus of the thalamus, the centromedian nucleus of the thalamus, and the hippocampus.Copyright Wiley Periodicals, Inc. © 2017 International League Against Epilepsy",0,,,
212,"We describe five patients with frontal lobe epilepsy who underwent electrocortical stimulation (ES) for language localization and language functional magnetic resonance imaging (fMRI) prior to epilepsy surgery. Six months after surgery, three patients suffered from a drop of verbal fluency. In all of them, frontal areas with presurgical language fMRI activity were resected. Our results suggest that resection in regions of areas with presurgical fMRI activation is not without risk for a postsurgical loss of function, even when ES results were negative for language function in these areas. Using fMRI activations might be specifically helpful to plan the resection when ES delivered inconclusive results.Copyright © 2017 Informa UK Limited, trading as Taylor & Francis Group.",5,,,
213,"Background: Post-hypoxic myoclonus (PHM) is a syndrome that occurs when a patient has suffered hypoxic brain injury. The myoclonus is usually multifocal and generalized, often stemming from both cortical and subcortical origins. In severe cases, pharmacological treatments with antiepileptic medications may not satisfactorily control the myoclonus. Method(s): We present a case of a 23-year-old male with chronic medication refractory PHM following a cardiopulmonary arrest related to an asthmatic attack who improved with bilateral globus pallidus internus (GPi) deep brain stimulation (DBS). We review the clinical features of PHM, as well as the preoperative and postoperative Unified Myoclonus Rating Scale scores and DBS programming parameters in this patient and compare them with the three other published PHM-DBS cases in the literature. Result(s): This patient experienced an alleviation of myoclonic jerks at rest and a 39% reduction in action myoclonus with improvement in both positive and negative myoclonus with bilateral GPi-DBS. High frequency stimulation (130 Hz) with amplitudes >2.5 V were needed for the therapeutic response. Discussion(s): We demonstrate a robust improvement in a medication refractory PHM patient with bilateral GPi-DBS, and suggest that it is a viable therapeutic option for debilitating post-hypoxic myoclonus.Copyright © 2017 Ramdhani et al.",1,,2.5,
214,"Objective: Evaluate the seizure-reduction response and safety of mesial temporal lobe (MTL) brain-responsive stimulation in adults with medically intractable partial-onset seizures of mesial temporal lobe origin. Method(s): Subjects with mesial temporal lobe epilepsy (MTLE) were identified from prospective clinical trials of a brain-responsive neurostimulator (RNS System, NeuroPace). The seizure reduction over years 2-6 postimplantation was calculated by assessing the seizure frequency compared to a preimplantation baseline. Safety was assessed based on reported adverse events. Result(s): There were 111 subjects with MTLE; 72% of subjects had bilateral MTL onsets and 28% had unilateral onsets. Subjects had one to four leads placed; only two leads could be connected to the device. Seventy-six subjects had depth leads only, 29 had both depth and strip leads, and 6 had only strip leads. The mean follow-up was 6.1 +/- (standard deviation) 2.2 years. The median percent seizure reduction was 70% (last observation carried forward). Twenty-nine percent of subjects experienced at least one seizure-free period of 6 months or longer, and 15% experienced at least one seizure-free period of 1 year or longer. There was no difference in seizure reduction in subjects with and without mesial temporal sclerosis (MTS), bilateral MTL onsets, prior resection, prior intracranial monitoring, and prior vagus nerve stimulation. In addition, seizure reduction was not dependent on the location of depth leads relative to the hippocampus. The most frequent serious device-related adverse event was soft tissue implant-site infection (overall rate, including events categorized as device-related, uncertain, or not device-related: 0.03 per implant year, which is not greater than with other neurostimulation devices). Significance: Brain-responsive stimulation represents a safe and effective treatment option for patients with medically intractable epilepsy, including patients with unilateral or bilateral MTLE who are not candidates for temporal lobectomy or who have failed a prior MTL resection.Copyright © 2017 The Authors. Epilepsia published by Wiley Periodicals, Inc. on behalf of International League Against Epilepsy.",111,,,
215,"Background Refractory status epilepticus (RSE) is considered a medical emergency in neurology and is related to high mortality. We report a successfully treated case of RSE using deep brain stimulation (DBS) at the anterior thalamic nuclei (ATN) in a 17-year-old woman. Results This patient developed RSE as a result of progressive seizure activity. RSE with generalized tonic-clonic seizures was noted 2 weeks before admission. Video electroencephalography monitoring showed continuous 3-Hz generalized spike-and-wave complexes with higher amplitude over bilateral frontal. Four weeks after RSE onset, bilateral DBS of the ATN was started. This treatment was immediately followed by the disappearance of tonic-clonic seizures and spike-and-wave complexes, suggesting resolution of the RSE. Significant clinical improvement was noted 1 week after DBS implantation. Conclusions DBS at the ATN significantly improved both the electroencephalography and clinical presentation in the patient with RSE. DBS at the ATN should be considered as a possible treatment choice once a patient develops RSE.Copyright © 2016 The Authors",1,,,
