,TEXT,SIZE,FREQMAX,VOLTMAX,AMPMAX
59,"Objective: Transcranial magnetic stimulation (TMS) modifies brain function by using a magnetic field to induce electrical currents in cortical neurones. Repetitive TMS (rTMS) in experimental models can increase seizure threshold, and clinical application of prolonged sequential rTMS in adults with poorly controlled epilepsy has reduced seizure frequency. Preliminary to assessing the efficacy of rTMA as a potential treatment for children with severe epilepsy, we carried out a prospective non-randomized pilot study of tolerability and acceptability. Method(s): Twenty children aged 5 to 15 years with severe epilepsy unresponsive to three anti-epileptic drugs (AEDs) received 20 minutes of low frequency rTMS on each of five consecutive days using a Medtronic dual pulse stimulator with figure-eight coil. Exclusion criteria included metallic implants, cortical neurosurgery, and vagal nerve stimulation. EEG was recorded before, during and after the treatment, and at 1, 2, and 6 months follow-up. Diaries of seizure frequency, duration, and type were completed for the same period, with pre- and post-treatment cognitive assessment. Result(s): Formal psychometric testing was inappropriate in 10 (50%) with severe developmental delay. Two children were withdrawn from the study during treatment because of seizures suddenly worsened. All other children completed the treatment, which was well tolerated. One child had nausea and vomiting on the first treatment day, which resolved; no other side-effects were reported and no seizures occurred during treatment. Improvement in seizure frequency was reported in four of the 18 children completing the treatment, with a corresponding decrease in EEG epileptic spiking in two. Conclusion(s): For children with severe epilepsy unresponsive to drug treatment, rTMS may offer an alternative that is easily administered, well tolerated, non-invasive, compatible with medication and free of serious side-effects. Based on this pilot, a larger placebo-controlled study is required to assess efficacy.",0,,,
60,"Patients with medically intractable epilepsy who are not candidates for epilepsy surgery could benefit from neurostimulation. At this time, vagus nerve stimulation (VNS) therapy is the only Food and Drug Administation-approved neurostimulation modality; it has been shown to be efficacious and just as well tolerated in children and adolescents as in adults. Notwithstanding the initial cost of the device and implantation, VNS therapy has been shown to be a cost-effective treatment, reducing direct medical costs and improving health-related quality of life measures. Deep brain stimulation of various brain regions, especially the anterior nucleus of the thalamus and responsive neurostimulation, also appear effective but are not yet approved for clinical use. Repetitive transcranial magnetic stimulation, which is also in early clinical development, is promising and could become available in the not too distant future. © 2011 Elsevier Inc.",0,,,
61,"Objectives: This multicenter, double-blind, randomized controlled trial assessed the safety and effectiveness of responsive cortical stimulation as an adjunctive therapy for partial onset seizures in adults with medically refractory epilepsy. Method(s): A total of 191 adults with medically intractable partial epilepsy were implanted with a responsive neurostimulator connected to depth or subdural leads placed at 1 or 2 predetermined seizure foci. The neurostimulator was programmed to detect abnormal electrocorticographic activity. One month after implantation, subjects were randomized 1:1 to receive stimulation in response to detections (treatment) or to receive no stimulation (sham). Efficacy and safety were assessed over a 12-week blinded period and a subsequent 84-week open-label period during which all subjects received responsive stimulation. Result(s): Seizures were significantly reduced in the treatment (-37.9%, n = 97) compared to the sham group (-17.3%, n = 94; p = 0.012) during the blinded period and there was no difference between the treatment and sham groups in adverse events. During the open-label period, the seizure reduction was sustained in the treatment group and seizures were significantly reduced in the sham group when stimulation began. There were significant improvements in overall quality of life (p < 0.02) and no deterioration in mood or neuropsychological function. Conclusion(s): Responsive cortical stimulation reduces the frequency of disabling partial seizures, is associated with improvements in quality of life, and is well-tolerated with no mood or cognitive effects. Responsive stimulation may provide another adjunctive treatment option for adults with medically intractable partial seizures. Classification of evidence: This study provides Class I evidence that responsive cortical stimulation is effective in significantly reducing seizure frequency for 12 weeks in adults who have failed 2 or more antiepileptic medication trials,3or more seizures per month, and 1 or 2 seizure foci. © 2011 by AAN Enterprises, Inc.",0,,,
62,"Rationale: Vagus nerve stimulation and callosal section are the available palliative surgical options in patients with secondary generalized epilepsy. DBS has been increasingly used in the treatment of refractory epilepsy over the last decade. We report on the outcome after CM-DBS in patients with generalized epilepsy who had been previously treated with extended callosal section. Method(s): Six consecutive patients with generalized epilepsy who were previously submitted to callosal section and had at least 1 year of follow-up after deep brain implantation were studied. Age ranged from 10 to 44 years. All patients were submitted to bilateral CM thalamic DBS. Post-operative CT scans documented the electrode position in all patients. All patients had pre- and post-stimulation prolonged interictal scalp EEG recordings, including spike counts. Attention level was evaluated by means of the SNAP-IV questionnaire. The preimplantation anti-epileptic drug regimen was maintained postoperatively in all patients. Continuous stimulation was carried out using 300usec, 130Hz, 4-6V pulses. Result(s): Post-operative CT documented that all electrodes were correctly located. There was no morbidity or mortality. Seizure frequency reduction ranging from 55 to 95% and increased attention level was seen in all patients. Interictal spiking frequency was reduced from 25 to 95%, but their morphology remained the same. There was re-synchronization of interictal discharges during slow-wave sleep in 3 patients. Conclusion(s): All patients benefit from the procedure. The CM seems to play a role in modulating the epileptic discharges and attention in these patients. On the other hand, it is not the generator of the epileptic abnormality and appeared not to be involved in non-REM sleep-related interictal spiking modulation.",6,,6.0,
63,"Background: Abnormally enhanced cortical rhythmic activities have been reported in patients with cortical myoclonus. We recently reported a new triad-conditioning transcranial magnetic stimulation (TMS) method to detect the intrinsic rhythms of the primary motor cortex (M1). Triad-conditioning TMS revealed a 40-Hz intrinsic rhythm of M1 in normal subjects. In this investigation, we study the motor cortical facilitation induced by rhythmic triple TMS pulses (triad-conditioning TMS) in patients with cortical myoclonus. Method(s): Subjects were 7 patients with cortical myoclonus (28-74 years old) and 13 healthy volunteers (30-71 years old). Three conditioning stimuli over M1 at the intensity of 110% active motor threshold preceded the test TMS at various interstimulus intervals corresponding to 10-200 Hz. The resulting amplitudes of conditioned motor evoked potentials recorded from the contralateral hand muscle were compared with those evoked by the test stimulus alone. Result(s): The facilitation at 25 ms (40 Hz) observed in normal subjects was absent in patients with cortical myoclonus. Instead, triad-conditioning TMS induced facilitation at a 40 ms interval (25 Hz) in cortical myoclonus. Discussion(s): This change in the timing of facilitation may be explained by a shift of the most preferential intrinsic rhythm of M1, or by some dysfunction in the interneuronal network in cortical myoclonus. © 2011 Movement Disorder Society.",7,,,
64,"Experimental and clinical data suggest that high-frequency deep brain stimulation (DBS) of different subcortical structures can be used to control or modulate epileptic seizures. Recent studies showed that DBS of the substantia nigra reticulata (SNr) in rats has an anticonvulsant effect on forebrain clonic seizures. The aim of this study was to determine whether DBS of SNr could also suppress tonic epileptic seizures evoked in hindbrain structures. DBS with high frequency often mimics the effects of surgical ablation of a particular area of the brain. However, the optimal parameters of DBS stimulation to induce ablation-like effects on seizures are not well defined. Consequently, in the first experiment we examined the effects of different stimulation frequencies (80, 130, 260 and 390 Hz) on neuronal activation induced in SNr, using c- fos immunocytochemistry. The results showed that the stimulation of the SNr with 80 Hz has no inhibitory effect while stimulation with 130, 260 and 390 Hz produced a remarkable suppressive effect compared with the control unstimulated side. The aim of the second experiment was to determine whether bilateral inhibition of SNr with DBS could suppress tonic seizures induced by electric shock. Statistical analysis showed that the mean tonic seizure scores following SNr stimulation with either 130 or 260 Hz were not significantly different from scores following the application of the electrode without current. The data suggest that DBS of the SNr produces neuronal inhibition but fails to suppress tonic seizures. We conclude, therefore, that DBS of SNr with frequencies used in this study might not be effective for treatment of patients who suffer from tonic epileptic seizures. © 2011 Elsevier Inc.",0,,,
65,"Purpose: To evaluate the antiepileptic efficacy of low frequency repetitive transcranial magnetic stimulation (rTMS) in medically intractable epilepsy. Method(s): A comprehensive literature search was performed on articles published from 1990 to 2010 in Medline, Pubmed, CINAHL, and Cochrane using the following keywords: epilepsy, seizure, transcranial magnetic stimulation, repetitive transcranial magnetic stimulation. Two reviewers assessed article eligibility and extracted the data independently. For outcome measures, effect size and 95% confidence interval (CI) were calculated for seizure frequency, spike number, duration of epileptiform abnormalities (EAs), and resting motor threshold (RMT) by using fixed and random effect models. Result(s): Eleven articles were identified, with a total of 164 participants. Based on seizure frequency, a significant effect size was found (effect size: 0.34, with a 95% CI at 0.10-0.57). Considering between-study heterogeneity, we conducted a second meta-analysis, and the underlying etiology was considered important for the treatment effect. Cortical dysplasia or neocortical epilepsy showed an effect size of 0.71, with a 95% CI at 0.30-1.12. In contrast, other epileptic disorders showed an effect size of 0.22. Conclusion(s): Low frequency rTMS has a favorable effect on seizure reduction, particularly evident in patients with neocortical epilepsy or cortical dysplasia. © 2011 Elsevier B.V.",0,,,
66,"Congenital central hypoventilation syndrome (CCHS) is a rare, idiopathic disorder characterized by a failure of automatic respiration. Abnormalities such as seizure disorder, failure to thrive, and Hirschsprung disease have been associated with CCHS. In this report, the authors discuss the use of vagal nerve stimulation (VNS) to treat a medically refractory seizure disorder in a child who had previously undergone placement of bilateral phrenic nerve stimulators for treatment of CCHS. Concomitant use of phrenic and vagal nerve stimulators has not previously been reported in the literature. No adverse reactions were noted with both devices working. Diaphragmatic pacing (DP) was clinically unaffected by VNS. The patient experienced a marked reduction in seizure frequency and severity following vagal nerve stimulator placement. Based on this case, the authors conclude that VNS is a potentially safe and efficacious treatment option for seizure disorder associated with CCHS in patients undergoing DP. ©1944-2011 by the American Association of Neurosurgeons.",1,,,
67,"Surgical treatment of intractable epilepsy with deep brain stimulation (DBS) has been shown to be of therapeutic benefit in some patients and with the recent publication of a randomised control study its use is likely to increase in the future. We describe a patient who developed a focal epileptic seizure within a few seconds of momentarily turning off the DBS stimulator in the nucleus ventralis oralis posterior, with which she was successfully treated for tremor. The seizure was the result of a newly diagnosed primary brain tumor. We suggest that the nucleus ventralis oralis posterior may be another thalamic target of DBS in epilepsy. © 2010 Elsevier Ltd. All rights reserved.",1,,,
68,"BACKGROUND: Cortical stimulation is under investigation in clinical trials of drugresistant epilepsy. Results are heterogeneous; therefore, more evidence from animal studies is required. OBJECTIVE(S): To investigate the therapeutic effects of parameters of direct stimulation of the cortical focus in a Macaca fascicularis presenting focal motor epilepsy. METHOD(S): We developed a model of motor seizures after intracortical injection of penicillin G in the primary motor cortex of a Macaca fascicularis. We performed electric epidural cortical stimulation at low, medium, and high frequency using continuous or short-term stimulation. Short-term stimulation was triggered on seizure onset, either visually or automatically with a seizure detection algorithm connected to a programmable stimulator. RESULT(S): Automated detection could detect 100% of the seizures, but ensuing cortical electric stimulation failed to abort seizures. CONCLUSION(S): This study demonstrates the inefficacy of the stimulation of the cortical focus to prevent seizures induced by local injection of penicillin G. Because this model may be too severe to allow comparison to human epilepsies, further work is required in other monkey models of focal epilepsy. Copyright © 2011 by the Congress of Neurological Surgeons.",0,,,
69,"Epileptic foci can influence cortical excitability, brain perfusion and metabolism not only directly in the focus or perifocally, but also in remote areas. Effects of successful epilepsy surgery on cortical networks and changes in excitability have rarely been addressed. We report a study on changes in interhemispheric inhibition following successful surgical removal of an epileptic focus. Eighteen patients (11 females, 7 males, mean age 34.2 years) were enrolled in this transcranial magnetic stimulation (TMS) study. All patients were seizure free after surgery and had identical antiepileptic medication pre- and postsurgically. Investigations were performed before and at least 3 months after surgery. Motor thresholds (MT) and motor evoked potentials (MEPs) of interhemispheric paired pulse paradigms were investigated on both hemispheres. Resection of the epileptic focus resulted in a significant change in interhemispheric inhibition (IHI). The ability of the non-focal hemisphere to inhibit the motor cortex (M1) of the focal hemisphere significantly increased (p = 0.02) and normalized to the level of the other hemisphere. In summary, this TMS study suggests that an epileptic focus can modulate interhemispheric inhibitory interactions between the motor cortices. A decreased susceptibility of M1 of the focal hemisphere or alterations in the non-focal hemispheric inhibitory output may be underlying mechanisms. These findings may contribute to a better understanding of widespread functional impairments in focal epilepsy. © 2010 Springer-Verlag.",18,,,
70,"Purpose: To assess the efficacy and tolerability of chronic high-frequency deep brain stimulation (DBS) in adult patients with progressive myoclonic epilepsy (PME) syndromes. Method(s): Five adult patients (four male, 28-39 years) with PME underwent chronic high-frequency DBS according to a study protocol that had been approved by the local ethics committee. Electrodes were implanted in the substantia nigra pars reticulata (SNr)/subthalamic nucleus (STN) region in the first patient and additionally in the ventral intermediate nucleus (VIM) bilaterally in the following four cases. Follow-up took place in intervals of 3 months and DBS effects were compared with baseline frequency of passive and activation-induced myoclonic jerks and daily life performance 8 weeks prior to implantation. Key Findings: Follow-up periods ranged from 12-42 months (median 24 months). The best clinical effects were seen with SNr/STN DBS in all patients. VIM stimulation failed to achieve acute therapeutic effects and revealed low side-effect thresholds and even triggering of myoclonia. In all patients the reduction of myoclonic seizures was observed and ranged between 30% and 100% as quantified by a standardized video protocol. All patients reported clinically relevant improvements of various capabilities such as free standing and walking or improved fine motor skills. In one patient with an excellent initial response generalized tonic - clonic seizures increased after 3 months of stimulation following extensive trauma-related surgery. The best effect was seen in the least impaired patient. Significance: DBS of the SNr/STN may be an effective treatment option for patients with PME. Less impaired patients may benefit more markedly. Wiley Periodicals, Inc. © 2011 International League Against Epilepsy.",5,,,
71,"Seventeen refractory partial epilepsy patients were enrolled in an open-label study to evaluate the antiepileptic effect of low-frequency repetitive transcranial magnetic stimulation (rTMS). Seven of the patients had not obtained seizure-free status after epileptogenic focus resection surgery before they were enrolled in the study. All patients were treated with low-frequency rTMS which included 3 sessions per day (0.5 Hz, 90% RMT and 500 pulses each session) and lasted for 2 weeks. Seizure frequency, seizure days and epileptic discharges in the EEG obtained before, during and after stimulation were compared. The psychological conditions of all individual patients were evaluated with Symptom Checklist-90 (SCL-90) before and after rTMS treatment. Mean seizure frequencies per week significantly decreased in the following 4-week rTMS treatment period compared with the pre-treatment period (14.09 vs. 5.63, p < 0.05, mean reduction of 60.02% in seizure frequency). Mean seizure days per week during the treatment period and the post-treatment period were lower than that of the pre-treatment period (5.18 vs. 2.99 p < 0.05, mean reduction of 42.5% in seizure days). Mean epileptic discharges in the EEG decreased significantly during the treatment period compared to that of the pre-treatment period (78.60 vs. 66.09, p < 0.05, mean reduction of 15.9% in epileptic spikes discharges) in all 17 patients. Fourteen patients completed the test of Symptom Checklist-90 effectively. The scales of Global Severity Index, Depression, Anxiety, Phobic anxiety, Paranoid ideation, Psychoticism, Somatization, Obsession-compulsion, Interpersonal sensitivity, Hostility in patients decreased respectively at the post-treatment periods compared with those of the pre-treatment periods (P < 0.05). Low-frequency rTMS may have a significant antiepileptic effect in patients with refractory partial epilepsy. Additionally, our results indicate rTMS treatment can improve the psychological condition of these patients.",17,,,
72,"We report two cases of chronic therapeutic stimulation of epileptic foci localized in motor areas. Case 1 is an adolescent with supplementary motor area seizures whose intracranial recordings showed a right SMA focus. Case 2 is a female teenager with primary motor seizures originating in the right motor cortex in the hand area as shown by her intracranial recordings and cortical mapping. Both had apparently normal MRI. Chronic stimulation of the epileptic focus decreased the number of seizures more than 90% the seizure number while preserving motor function. None of the patients had side effects. Neuromodulation is proposed as a safe, efficient surgical alternative for motor seizure control.",0,,,
73,"Following a total of 386 deep brain stimulation (DBS) procedures in Oxford, only two seizures have been recorded in the peri-operative period. Both patients had MS and underwent thalamic DBS for tremor and these 2 cases are presented here. The incidence of peri-operative seizures in MS patients undergoing DBS procedures is more than 8-fold greater than that expected for patients undergoing DBS procedures. Further experience with DBS procedures in MS patients is needed to determine whether there is a role for peri-operative anticonvulsants in these patients. © 2010 The Neurosurgical Foundation.",0,,,
74,"INTRODUCTION: Many patients with epilepsy have persistent seizures despite maximal antiepileptic drug therapy and are not candidates for resective brain surgery. We investigated the effectiveness of seizure reduction after anterior thalamic stimulation in patients with intractable epilepsy undergoing deep brain stimulation (DBS) of the thalamus. METHOD(S): Fifteen patients with medically refractory epilepsy underwent bilateral DBS electrodes in the anterior thalamus. Seizure frequency and intensity were monitored and compared with pre-implantation baseline. The following outcome variables were assessed: (a) total seizure-frequency between postoperative 3 month and preoperative baseline (b) total seizure-frequency between postoperative 3 month and the last followup. Range in seizure reduction percentage was bounded at -100 and +100% (seizure-free). Seizure intensity at last visit was also assessed. (2: much improved; 1: slightly improved; 0: no interval change) RESULTS: The follow-up patients were 15 (9 males and 6 females). Median age at the operation was 30.53 years (range, 14-54 years) (Table 1). Treatment showed a statistically significant decrease in seizure frequency, with a mean reduction of 70.5% (mean follow-up, 39 months). Two of the patients had a remarkable reduction of seizure intensity as well as seizure frequency (Table 2). Seizure frequency per month at postoperative 3-month and last follow-up period after ATN DBS shows significant reduction of seizure frequency (P =.002, P =.001, respectively). Reduction percentage of seizure frequency at postoperative 3-month has significant relation with reduction percentage of seizure frequency at last follow-up period (P = .032)(Figure 1). CONCLUSION(S): It seems to be important that short term outcome of ATN DBS reflects long term outcome directly. The correlation between seizure type, characteristics and anticonvulsant effect of ATN DBS did not showed significantly because of small case numbers. Therefore longerterm follow-up with larger group of patients is required to fully evaluate the safety and effectiveness of this treatment modality.",15,,,
75,"Objective: The low-frequency repetitive transcranial magnetic stimulation (rTMS) treatment on patients with intractable epilepsy often shows variable antiepileptic effects, and its mechanisms remain to be understood. We aimed to further investigate the effectiveness of rTMS on intractable epilepsy, and study whether cortical excitability, and cerebral blood flow could change after rTMS treatment by using evoked resting motor threshold (ERMT) and single photo emission computered tomography (SPECT), respectively. Method(s): We enrolled 4 patients with localization-related epilepsy who had experienced at least 1 seizure per month after regular antiepileptic medications for at least 1 year. rTMS treatment was administered at 0.5 Hz and 45% of the stimulator's maxiumum output for 10 consecutive days. Frequency of seizures was determined for 3 months before and after rTMS. The electroencephalogram (EEG) was recorded before and after rTMS, respectively. Each recording was no less than 1hour, and the number of interictal spikes was counted. ERMT and SPECT were used to investigate the changes of cortical excitability and cerebral blood flow, respectively. Result(s): In all patients, seizure frequency was significantly decreased after rTMS treatment: only one patient had a generalized seizure at the third month; the other three patients had no seizures in the subsequent 3-month follow-up. The SPECT analysis showed the cerebral perfusion a conspicuous decrease around the stimulated regions in all patients. EEG displayed a minimal improvement on the epileptiform discharges (-20%) in a patient after rTMS. The ERMT was found to be significantly elevated after rTMS treatment in these 4 patients studied. Conclusion(s): This study suggests that rTMS was effective in the treatment of patients with intractable epilepsy, and this effect might be related to the elevation of EMRT and the reduction of the cerebral perfusion in the epileptogenetic zones. However, this clinical research was based on very small population. Larger population is needed for further study.",4,,,
