,TEXT,SIZE,FREQMAX,VOLTMAX,AMPMAX
124,"Objective: We report on the seizure frequency and attention outcome during thalamic centromedian stimulation (CM-DBS) in patients with refractory generalized epilepsy (GE). Method(s): Twenty consecutive patients with GE who were submitted to CM-DBS and had at least one year of follow-up were prospectively studied. The CM was targeted bilaterally. Stimulation intensity was ramped up (bipolar, continuous, 130 Hz; 300musec) until 4.5 V or until side effects developed. Contacts' position was determined on postoperative volumetric MRI scans. Attention was qualitatively evaluated using the SNAP-IV (Swanson, Nolan, and Pelham) questionnaire. Patients were considered responders during CM-DBS if an at least 50% seizure frequency reduction was obtained compared to baseline. Result(s): Median age was 15.5 years (13 males). Median follow-up time was 2.55 years. EEG disclosed generalized spike-and wave discharges in all patients. MRI was normal in 10 patients, showed diffuse atrophy in 6 patients, and showed abnormalities in 4 patients (3 patients had bilateral cortical development abnormalities and one had unilateral hemispheric atrophy). Patients presented with daily multiple seizure types (8 to 66 per day; median: 37), including tonic, atonic, myoclonic, atypical absence and generalized tonic-clonic seizures. Mean DBS intensity was 4.3 V. An insertional effect was noted in 14 patients. CM-DBS was able to significantly reduce the frequency of tonic (p < 0.001), atypical absence seizures (p < 0.001), atonic seizures (p = 0.001) and bilateral generalized tonic-clonic seizures (p = 0.004). One patient became seizure-free. Ninety percent of the patients were considered responders (>50% seizure frequency reduction). All patients showed some improvement in attention. The mean number of items in which improvement was noted in the SNAP-IV questionnaire was 4.8. There was a significant relationship between overall seizure frequency reduction and improvement of attention (p = 0.033). Discussion(s): This prospective, open label study included a large, homogeneous cohort and provided evidence on the efficacy of CM-DBS in reducing the seizure burden and increasing attention in patients with refractory generalized epilepsy.Copyright © 2020 British Epilepsy Association",20,,4.5,
125,"Objective: The aim of the study was to determine if corticothalamic responsive stimulation targeting the centromedian nucleus of the thalamus (CMT) is a potential treatment for neocortical epilepsies with regional onsets. Method(s): We assessed efficacy and safety of CMT and neocortical responsive stimulation, detection, and stimulation programming, methods for implantation, and location and patterns of electrographic seizure onset and spread in 7 patients with medically intractable focal seizures with a regional neocortical onset. Result(s): The median follow-up duration was 17 months (average: 17 months, range: 8-28 months). The median % reduction in disabling seizures (excludes auras) in the 7 patients was 88% (mean: 80%, range: 55-100%). The median % reduction in all seizure types (disabling + auras) was 73% (mean: 67%, range: 15-94%). There were no adverse events related to implantation of the responsive neurostimulator and leads or related to the delivery of responsive stimulation. Stimulation-related contralateral paresthesias were addressed by adjusting stimulation parameters in the clinic during stimulation testing. Electrographic seizures were detected in the CMT and neocortex in all seven patients. Four patients had simultaneous or near simultaneous seizure onsets in the neocortex and CMT and three had onsets in the neocortex with spread to the CMT. Conclusion(s): In this small series of patients with medically intractable focal seizures and regional neocortical onset, responsive neurostimulation to the neocortex and CMT improved seizure control and was well tolerated. Significance: Responsive corticothalamic neurostimulation of the CMT and neocortex is a potential treatment for patients with regional neocortical epilepsies.Copyright © 2020 The Authors",7,,,
126,"Introduction: Although deep brain stimulation of the anterior nucleus of the thalamus (ANT-DBS) represents an established third-line therapy for patients with drug-resistant focal epilepsy, guiding reports on practical treatment principles remain scarce. Method(s): An Expert Panel (EP) of 10 European neurologists and 4 neurosurgeons was assembled to share their experience with ANT-DBS therapy. The process included a review of the current literature, which served as a basis for an online survey completed by the EP prior to and following a face-to-face meeting (Delphi method). An agreement level of >=71 % was considered as consensus. Result(s): Out of 86 reviewed studies, 46 (53 %) were selected to extract information on the most reported criteria for patient selection, management, and outcome. The Delphi process yielded EP consensus on 4 parameters for selection of good candidates and patient management as well as 7 reasons of concern for this therapy. Since it was not possible to give strict device programming advice due to low levels of evidence, the experts shared their clinical practice: all of them start with monopolar stimulation, 79 % using the cycling mode. Most (93 %) EP members set the initial stimulation frequency and pulse width according to the SANTE parameters, while there is more variability in the amplitudes used. Further agreement was achieved on a list of 7 patient outcome parameters to be monitored during the follow-up. Conclusion(s): Although current evidence is too low for definite practical guidelines, this EP report could support the selection and management of patients with ANT-DBS.Copyright © 2020 The Author(s)",7,,,
127,"Objectives: Deep brain stimulation (DBS) of the anterior thalamic nucleus (ATN) has been recognized to be an efficient treatment of refractory epilepsy (RE). However, ATN targeting is difficult and up to 8% of lead misplacement is reported. Our objective is to report our surgical procedure based on MRI targeting and our clinical results. Patients and Methods: Our first five consecutive patients (4M, 1F, mean age: 42.8 years) treated by DBS of ATN between March and October 2016 were included. The mean duration of their epilepsy was 29 years. Four patients had already vagal nerve stimulation and 2 mammillary body stimulation. Stereotactic coordinates were calculated using distal segment of mammillothalamic tract as landmark. All procedures were performed under general anesthesia with intraoperative control of lead position using a robotic 3D fluoroscopy and image fusion with the preoperative MRI. Result(s): No complications or lead misplacement was observed. The mean 3D distance between the planned target and location of the lead was 1.8 mm. Each patient was followed up at least one year (15 + 3 months). The stimulation parameters were: 140 Hz, 90 m/s and 5 Volts with one minute ON/five minutes OFF cycle. The mean reduction of seizure frequency reached -52.5% (+32.2) at 6-months but decreased to -24.5% (+65.7) at the last follow-up due to some adverse events not related to stimulation. Conclusion(s): No complication, no lead misplacement and the improvement in our first patients, previously not help by multiple medications or surgeries, are encouraging.Copyright © 2020 Elsevier Masson SAS",5,,,
128,"Objective Headache disorders are frequently associated with epilepsy. Some neuromodulation techniques for refractory epilepsy have been reported to positively influence the associated chronic headache. However, the exact mechanism of action of vagus nerve stimulation (VNS) and anterior thalamic nuclei-deep brain stimulation (ANT-DBS) on pain perception is unclear. Method We report a structured assessment of pain perception in a patient who experienced headache relief after ANT-DBS for refractory focal epilepsy and compare it with pain perception of epilepsy patients with chronic headache who were treated with and without VNS. Results The pain-associated symptoms in the ANT-DBS case were on the Pain Anxiety Symptoms Scale (PASS-40) subscore physiological anxiety closer to the control collective, whereas in patients with VNS, this was more likely for the PASS-40 subscores cognitive anxiety or escape and avoidance. Conclusion ANT-DBS and VNS may influence epilepsy-associated chronic headache in different ways.Copyright © 2020 by Thieme Medical Publishers, Inc., 333 Seventh Avenue, New York, NY 10001, USA.",1,,,
129,"Purpose: Children with benign epilepsy with centrotemporal spikes have rare seizures emerging from the motor cortex, which they outgrow in adolescence, and additionally may have language deficits of unclear etiology. We piloted the use of transcranial magnetic stimulation paired with EMG and EEG (TMS-EMG, TMS-EEG) to test the hypotheses that net cortical excitability decreases with age and that use-dependent plasticity predicts learning. Method(s): We assessed language and motor learning in 14 righthanded children with benign epilepsy with centrotemporal spikes. We quantified two TMS metrics of left motor cortex excitability: the resting motor threshold (measure of neuronal membrane excitability) and amplitude of the N100-evoked potential (an EEG measure of GABAergic tone). To test plasticity, we applied 1 Hz repetitive TMS to the motor cortex to induce long-term depression-like changes in EMG- and EEG-evoked potentials. Result(s): Children with benign epilepsy with centrotemporal spikes tolerate TMS; no seizures were provoked. Resting motor threshold decreases with age but is elevated above maximal stimulator output for half the group. N100 amplitude decreases with age after controlling for resting motor threshold. Motor cortex plasticity correlates significantly with language learning and at a trend level with motor learning. Conclusion(s): Transcranial magnetic stimulation is safe and feasible for children with benign epilepsy with centrotemporal spikes, and TMS-EEG provides more reliable outcome measures than TMS-EMG in this group because many children have unmeasurably high resting motor thresholds. Net cortical excitability decreases with age, and motor cortex plasticity predicts not only motor learning but also language learning, suggesting a mechanism by which motor cortex seizures may interact with language development.Copyright © 2020 by the American Clinical Neurophysiology Society.",0,,,
130,"Purpose: Despite the availability of numerous pharmacologic and nonpharmacologic antiseizure therapies, a fraction of patients with epilepsy remain refractory to current treatment options, underscoring the need for novel drugs and neuromodulatory therapies. Transcranial magnetic stimulation (TMS), coupled with either electromyography or electroencephalography, enables rapid measurement of the cortical excitation/inhibition ratio, which is pathologically shifted toward excess excitability in patients with epilepsy. In this review, we summarize: (1) TMS protocols that have been deployed to identify promising compounds in the antiepilepsy drug (AED)-development pipeline, and (2) the therapeutic potential of TMS in the treatment of drug-resistant seizures. Method(s): A focused literature review of the use of TMS in epilepsy, using a PubMed search, was performed. Over 70 articles were included that pertained to: (1) the use of TMS-EMG and TMS-EEG in elucidating the mechanisms of action of AEDs and in discovering potential new AEDs; and (2) the use of repetitive TMS in the treatment of seizures. Finding(s): Studies from the literature have reported that AEDs alter TMS-derived metrics, typically by leading to a net increase in cortical inhibition with successful therapy. Preclinical TMS work in rodent models of epilepsy has led to the development of novel antiseizure drug compounds. Clinical translational studies of TMS have been used to determine guidelines on the dosages of other agents in the AED pipeline in preparation for clinical trials. Several studies have described the use of therapeutic repetitive TMS in both the ictal and interictal states of epilepsy, with inconsistent results. Implications: TMS has diagnostic and therapeutic potential in epilepsy. TMS-derived markers can enable early-stage measures of AED target engagement, and can facilitate studies of the pharmacokinetic and pharmacodynamic properties of AEDs. TMS may also be used in the early prediction of the efficacy of different AEDs in treating patients, and in direct neuromodulation of epileptic networks. From the therapeutics perspective, despite favorable results in some trials, the optimization of treatment paradigms and the determination of ideal candidates for TMS are still needed. Finally, preclinical experiments of TMS have provided mechanistic insight into its effects on the excitation/inhibition ratio, and may facilitate rational drug-device coupling paradigms. Overall, the capacity of TMS in both the modulation and measurement of changes in cortical excitability highlights its unique role in advancing antiepilepsy therapeuticsCopyright © 2020 Elsevier Inc.",0,,,
131,"Background: Preoperative thalamic targeting methods have historically relied on indirect targeting techniques that do not fully account for variances in anatomy or for thalamic atrophy in epilepsy. We aimed to address variability noted between traditional indirect targeting and direct targeting methods for the anterior nucleus of the thalamus (ANT). Method(s): Fifteen consecutive patients undergoing ANT deep brain stimulator placement were evaluated (30 thalamic nuclei). Direct ANT targeting was performed using a fast gray matter acquisition T1 inversion recovery sequence and compared with standard stereotactic coordinates. Thalamic volumes were calculated for each patient, and degree of thalamic volume loss was assessed compared with matched control subjects. Vertex analysis was performed to assess shape changes in the thalamus compared with age- and sex-matched subjects. Result(s): There was significant variation between direct and indirect targets in the y-axis and z-axis on both sides. On the left, the direct target was located at y = 2 +/- 1.3 mm and z = 9.3 +/- 1.8 mm (both P = 0.02). On the right, the direct target was located at y = 2.9 +/- 1.8 mm and z = 9.2 +/- 2 mm (both P <= 0.0003). There was no significant difference in the x-coordinate on either side (P > 0.5). Additionally, there was a correlation between thalamic volume and difference between direct and indirect targets in the y-axis and the z-axis. Conclusion(s): We showed a significant difference in direct and indirect targeting in the y-axis and z-axis when targeting the ANT for deep brain stimulation for epilepsy. This difference is correlated to thalamic volume, with a larger difference noted in patients with thalamic atrophy.Copyright © 2020 Elsevier Inc.",15,,,
132,"Objective: Pharmaco-refractory focal motor epileptic seizures pose a significant challenge. Deep brain stimulation (DBS) is a recently recognized therapeutic option for the treatment of refractory epilepsy. To identify the specific target for focal motor seizures, we evaluate the modulatory effects of the subthalamic nucleus (STN) stimulation because of the critical role of STN in cortico-subcortical motor processing. Method(s): Seven patients with epilepsy with refractory seizures who underwent chronic stereoelectroencephalography (SEEG) monitoring were studied in presurgical evaluation. Seizure onset zone was hypothesized to be partially involved in the motor areas in 6 patients. For each patient, one electrode was temporally implanted into the STN that was ipsilateral to the seizure onset zone. The cortical-subcortical seizure propagation was systemically evaluated. The simultaneously electrophysiological responses over distributed cortical areas to STN stimulation at varied frequencies were quantitatively assessed. Result(s): We observed the consistent downstream propagation of seizures from the motor cortex toward the ipsilateral STN and remarkable cortical responses on motor cortex to single-pulse STN stimulation. Furthermore, we showed frequency-dependent upstream modulatory effect of STN stimulation on motor cortex specifically. In contrast to the enhanced effects of low frequency stimulation, high-frequency stimulation of the STN can significantly reduce interictal spikes, high-frequency oscillations over motor cortex disclosing effective connections to the STN. Interpretation(s): This result showed that the STN is not only engaged in as a propagation network of focal motor seizures but STN stimulation can profoundly modulate the epileptic activity of motor cortex in humans, suggesting a mechanism-based alternative for patients suffering from refractory focal motor seizures. ANN NEUROL 2020;88:283-296.Copyright © 2020 American Neurological Association",7,,,
133,"The purpose of this study was to investigate whether and how vagus nerve stimulation (VNS) reduces the epileptogenic activity in the bilateral cerebral cortex in patients with intractable epilepsy. We analyzed the electrocorticograms (ECoGs) of five patients who underwent callosotomy due to intractable epilepsy even after VNS implantation. We recorded ECoGs and analyzed power spectrum in both VNS OFF and ON phases. We counted the number of spikes and electrodes with epileptic spikes, distinguishing unilaterally and bilaterally hemispherically spread spikes as synchronousness of the epileptic spikes in both VNS OFF and ON phases. There were 24.80 +/- 35.55 and 7.20 +/- 9.93 unilaterally spread spikes in the VNS OFF and ON phases, respectively (P = 0.157), and 35.8 +/- 29.21 and 10.6 +/- 13.50 bilaterally spread spikes in the VNS OFF and ON phases, respectively (P = 0.027). The number of electrodes with unilaterally and bilaterally spread spikes in the VNS OFF and ON phases was 3.84 +/- 2.13 and 3.59 +/- 1.82 (P = 0.415), and 8.20 +/- 3.56 and 6.89 +/- 2.89 (P = 0.026), respectively. The ECoG background power spectra recordings in the VNS OFF and ON phases were also analyzed. The spectral power tended to be greater in the high-frequency band at VNS ON phase than OFF phase. This study showed the reduction of epileptogenic spikes and spread areas of the spikes by VNS as immediate effects, electrophysiologically.Copyright © 2020 by The Japan Neurosurgical Society.",5,,,
134,"Aim: To evaluate cortical excitability with transcranial magnetic stimulation (TMS) in children with new-onset epilepsy before and after antiepileptic drugs (AEDs). Method(s): Fifty-five drug-naive patients (29 females, 26 males; 3-18y), with new-onset epilepsy were recruited from 1st May 2014 to 31st October 2017 at the Child Neurology Department, Queen Silvia's Children's Hospital, Gothenburg, Sweden. We performed TMS in 48 children (23 females, 25 males; mean [SD] age 10y [3y], range 4-15y) with epilepsy (27 generalized and 21 focal) before and after the introduction of AEDs. We used single- and paired-pulse TMS. We used single-pulse TMS to record resting motor thresholds (RMTs), stimulus-response curves, and cortical silent periods (CSPs). We used paired-pulse TMS to record intracortical inhibition and facilitation at short, long, and intermediate intervals. Result(s): There were no differences in cortical excitability between children with generalized and focal epilepsy at baseline. After AED treatment, RMTs increased (p=0.001), especially in children receiving sodium valproate (p=0.005). CSPs decreased after sodium valproate was administered (p=0.050). As in previous studies, we noted a negative correlation between RMT and age in our study cohort. Paired-pulse TMS could not be performed in most children because high RMTs made suprathreshold stimulation impossible. Interpretation(s): Cortical excitability as measured with RMT decreased after the introduction of AEDs. This was seen in children with both generalized and focal epilepsy who were treated with sodium valproate, although it was most prominent in children with generalized epilepsy. We suggest that TMS might be used as a prognostic tool to predict AED efficacy. What this paper adds: Resting motor threshold (RMT) correlated negatively with age in children with epilepsy. No differences in cortical excitability were noted between patients with generalized and focal epilepsy. Treatment with antiepileptic drugs decreased cortical excitability as measured with transcranial magnetic stimulation (TMS). Decreased cortical excitability with increased RMT was recorded, especially after sodium valproate treatment. Paired-pulse TMS was difficult to perform because of high RMTs in children.Copyright © 2020 Mac Keith Press",55,,,
135,"Background: Neuromodulation is recommended for patients with refractory tuberous sclerosis related epilepsy (TRE) who are unable to localize epileptogenic nodules after comprehensive preoperative evaluation or for patients and families who do not agree to resection. Case Description: We report a patient with refractory TRE who received deep brain stimulation of anterior thalamic nucleus (ANT-DBS) and achieved a satisfactory response. To our knowledge, this is the first case of TRE being treated with ANT-DBS. A 22-year-old male was admitted to the hospital for refractory TRE seeking surgical treatment. Seizures were mainly manifested by deep temporal and frontal lobe epilepsy and suspected to originate in the limbic system. Magnetic resonance imaging revealed extensive potentially epileptogenic nodules in the brain lacking significant nodules. Scalp electroencephalogram showed a comprehensive, bilateral synchronous low-voltage rapid rhythm, unable to localize seizure origin. We performed bilateral ANT-DBS according to the preoperative evaluation, and the frequency and intensity of seizures were significantly reduced after the 15-month follow-up (P <0.05, Student's t-test). Our case extends the therapeutic indications of ANT-DBS to a certain extent, providing a neuromodulation alternative to vagus nerve stimulation for patients with TRE who are unsuitable candidates or refuse resection.Copyright © 2020 Elsevier Inc.",1,,,
136,"Background: Deep brain stimulation (DBS) of the anterior nucleus of the thalamus (ANT) is a recently approved therapy for patients with drug-resistant epilepsy. To date, there is a poor understanding of the mechanism of action and lack of in vivo biomarkers. We propose a method for investigating the in vivo stimulation effects using blood-oxygen-level-dependent (BOLD) magnetic resonance imaging (MRI) and present the brain activation pattern associated with ANT DBS. Method(s): Two patients undergoing ANT DBS for epilepsy underwent BOLD MRI using a block design after the DBS was programmed to alternate ON/OFF in 30-second blocks. The scanner was triggered using surface electrophysiologic recordings to detect the DBS cycle. Nine total runs were obtained and were analyzed using a general linear model. Result(s): Active ANT stimulation produced activation within several areas of the brain, including the thalamus, bilateral anterior cingulate and posterior cingulate cortex, precuneus, medial prefrontal cortex, amygdala, ventral tegmental area, hippocampus, striatum, and right angular gyrus. Conclusion(s): Using block-design BOLD MRI, we were able to show widespread activation resulting from ANT DBS. Overlap with multiple areas of both the default mode and limbic networks was shown, suggesting that these nodes may modulate the effect of seizure control with ANT DBS.Copyright © 2020 Elsevier Inc.",2,,,
137,"It remains an unsolved problem in the treatment of patients with refractory focal epilepsy originating from the motor cortex since resection surgery can result in significant morbidity. Neurostimulation has emerged as an effective method for treating patients who are not suitable for conventional surgical procedures due to its relative safety, reversibility, and lower risk of complications. The subthalamic nucleus (STN) has been shown to be a potential target for treating refractory motor seizures. Here, we report a favorable outcome of unilateral deep brain stimulation (DBS) of the STN for a patient with drug-resistant focal myoclonic seizures during a 5-year follow-up period.Copyright © Translational lung cancer research. All rights reserved.",1,,,
